{
  "$id": "https://jeremyosborne.com/dnpk/effect.schema.json",
  "$schema": "http://json-schema.org/draft-07/schema#",
  "title": "effect",
  "type": "object",
  "description": "Defines a single, particular, longer term effect.",
  "properties": {
    "documentation": {
      "description": "Human friendly documentation that can be stored with the (human unfriendly) JSON. For optimized systems, this attribute should be pruned at run time.",
      "type": "string"
    },
    "duration": {
      "description": "Number of turns this effect will last. Default duration of -1 describes a permanent effect.",
      "default": -1,
      "type": "integer"
    },
    "id": {
      "description": "Unique id for a particular instance of this type. Effects provided in nested data structures should not need an id.",
      "type": "string"
    },
    "magnitude": {
      "description": "Power level of this particular effect. Not always applicable for an effect.",
      "type": "integer"
    },
    "name": {
      "description": "Descriptive, unique name for this effect.",
      "type": "string"
    }
  }
}
