{
  "name": "constitution-aura",
  "documentation": "Provides a group wide health modification. Duration and magnitude are considered defaults, these values will often be edited. Meta-data provides the reasoning for why this bonus was applied, where it comes from.",
  "duration": -1,
  "magnitude": 1
}
